{
  "case_id": "case_07",
  "decision": "not_ready",
  "findings": [
    {
      "category": "error_handling",
      "severity": "high",
      "claim": "run_job suppresses every handler exception and falsely reports the failed job as successful, preventing callers from detecting or retrying failed work and potentially causing silent data loss or incomplete processing.",
      "evidence": [
        "evals/cases/case_07/src/jobs.py catches Exception from handler() and returns {\"status\": \"ok\", \"result\": None} from the exception path.",
        "A direct execution with a handler that raises RuntimeError('database write failed') returned {'status': 'ok', 'result': None}, confirming that an actual handler failure is presented as success.",
        "pytest -q evals/cases/case_07 passed its sole test, which covers only the successful handler path and therefore does not detect the false-success behavior."
      ],
      "verified": true,
      "confidence": 1.0
    }
  ],
  "uncertainties": []
}
