{
  "case_id": "case_06",
  "decision": "not_ready",
  "findings": [
    {
      "category": "retry_policy",
      "severity": "high",
      "claim": "The helper retries every Exception without distinguishing transient failures from deterministic or non-retryable failures, so failed operations can be executed repeatedly even when another attempt cannot succeed.",
      "evidence": [
        "evals/cases/case_06/src/retry.py:7-11 catches the undifferentiated Exception base class and continues the retry loop without a retryability predicate or exception allowlist.",
        "A runtime probe using an operation that always raises ValueError('invalid payload') showed that call_with_retry(..., attempts=3) invoked the operation three times before re-raising ValueError."
      ],
      "verified": true,
      "confidence": 0.99
    },
    {
      "category": "retry_policy",
      "severity": "high",
      "claim": "Retries run immediately with no delay, backoff, or jitter, which can amplify load against a failing dependency and make concurrent callers retry in lockstep during an outage.",
      "evidence": [
        "evals/cases/case_06/src/retry.py:7-11 immediately begins the next loop iteration after an exception; there is no sleep, backoff calculation, jitter, or server-directed delay handling.",
        "A runtime probe with three consecutive TimeoutError failures recorded only 2.515 and 1.332 microseconds between invocation timestamps, confirming that the attempts are issued as a hot loop."
      ],
      "verified": true,
      "confidence": 0.99
    }
  ],
  "uncertainties": [
    "The case does not document which exception types are intended to be retryable or whether callers guarantee that operations are idempotent.",
    "The case does not define an expected backoff schedule or maximum elapsed retry duration."
  ]
}
